Index,Date,Stars,Title,Review
82,"April 30, 2023",2.0,Wind Noise Terrible vs Gen 1,"Expected much improved performance vs. Gen 1 but wind noise (such as while riding a bike) is much worse. Found sound quality and noise cancellation improved (except wind noise). The wind noise is so much worse than Gen 1 the air pods are almost useless while riding a bike. Called Apple for help (they are usually great) but seems like they are in denial on this issue. An internet search revealed numerous complaints similar to mine. This is a major tarnish on Apple's reputation in my mind..... especially the lack of help. I do recall Bose having an issue with their sleep buds and they admitted the problem, offered refunds and eventually launched an improved product. Don't understand why Apple will not admit their problem"
83,"April 30, 2023",5.0,Best air pods,Great and light weight and affordable
84,"April 30, 2023",5.0,"Insane Sound, Quiet Background","Don't look for other earbuds. Seriously. I have tried every pair of earbuds Apple has made. I have also tried Sony's latest headphones that are ""industry leading,"" as well as a pair of Bose's headphones with ANC. These are either the same or better than all of those products. The sheer amount of features and unexpected quirks and the flow of UI on my phone make it worth the buy. You might think 200 dollars is expensive for earbuds, and I will say it is. But if you are looking for high-end sound in a comfortable earbud, then this is it. I will say that the battery life is slightly worse than I expected for the price. I wished they would last slightly longer. As of right now with use of like 12 hours every two days I am charging them about twice a week. Best wireless earbuds ever."
85,"April 30, 2023",5.0,NOT FAKE!,Very nice and loud if you want spatial audio you have to go to accessibility scroll down to audio/visual and if you have mono audio take it off the turn on spatial audio and it basically sounds like the music is following you if you turn your head left you hear it in your left if you turn your head right you hear it in your right. But overall very good and not fake.Also of you would like to check if it is fake go to checkcoverage.apple.com and type in the serial number and if it pops up your airpods it isnt fake and if it pop up a error sign it is fake
86,"April 30, 2023",5.0,Wife loves them,"Bought these for my wife who regularly complains about, well, a lot of stuff, but specifically the discomfort she has with most in ear speakers. The over the ear are, apparently, not acceptable as they mess with the hair. These are the first pair of ear buds she has actually used regularly. Wish I’d bought them sooner."
87,"April 30, 2023",5.0,Whats expected from Apple,"Excellent quality in minimal space. New ones are slightly better than Gen1. Liked new and enhanced noise reduction, vol controls on earbuds are tricky to use though. Still smallest one with best features in comparison to rivals Bose, Sony etc which I used all. Especially Bose was awful and probably shameful product with lots of software glitches and battery life (box and earphones battery was dying itself if not used within a week max)."
88,"April 30, 2023",1.0,Poor sound quality,"Since day one my son’s AirPods Pro microphone sound quality has been bad. The mic picks up tons of background noise and the audio is often garbled. To be fair, Apple support has been okay. The Genius Bar tried to help and even replaced the AirPods, but it did not help. Perhaps it’s the phone itself, an iPhone 11, and not the AirPods, but regardless, they are are virtually useless for phone conversations."
89,"April 30, 2023",3.0,Has color transferred from jeans pocket,"I always carried onn airpods in the same pocket never had color mark from jeans pocket, but this 200$ apple airpod case has blue mark from the same jeans pocket i am dissapointed that apple quality seems like less than onn case quality to me"
90,"April 30, 2023",5.0,Great,"Fits perfect, noise cancellation and high quality. I like it."
91,"April 30, 2023",4.0,Yes and no,"The noise cancellation was good. The sound quality was good. The ear tip size, even with special replacement tips, wasn't good. They made my ears hurt, so I had to return them and buy the regular, non-pro AirPod version."
92,"April 30, 2023",3.0,Works as advertised,They’re okay. Still uncomfortable and painful in my ears after two months. Ear canals get sweaty too. But I’m the coolest guy on the block with my dope airpods
93,"April 30, 2023",5.0,Airbuds,I love them!!!
94,"April 30, 2023",3.0,"Defective, slow support","Within five minutes of trying them on for the first time, the right earbud started making a loud hissing, squealing sound. This would come and go. They were perfect for a 2.5 hour flight. But after about two weeks, they were doing this after just a couple of minutes.It took 45 minutes with Apple support before they agreed that maybe they should take them back for ""repair"" and another 25 minutes to work out the return. Not to mention my time to drive them to a UPS Store, where the entire concept of returning Apple products seemed new to them. By comparison, I contacted support for my 3D printer recently and it took them 3 minutes to diagnose my problem and ship me a replacement part.I suppose I would have been better off with an appointment at an Apple store, but I was afraid they would work perfectly in the store (this seems to happen more in quiet locations)."
95,"April 30, 2023",2.0,N,It has Manu scratches as of it had aletearte been used
96,"April 29, 2023",5.0,Incredible well balanced sound!!! Buy them!!!,"Noise cancelling is amazing for such a small device! Integration w apple ecosystem is incredible! Bass is strong but well balanced, I am simply amazed by these things!!! Tried Beats Fit Pro and they absolutely suck compared to these!"
97,"April 29, 2023",5.0,Awestruck,I don’t know if it is particular to these EarPods but the noise cancelling feature is jaw dropping. I seriously couldn’t believe my ears. Technology is amazing. Would do this purchase 10 times over.
98,"April 29, 2023",1.0,Do not buy,Mine have had consistent issues since purchasing. This is my 3rd pair but the only I’ve bought from Amazon and this is the only pair having issues. Box will not stay charged and will not recognize when the ear buds are in place.
