Index,Date,Stars,Title,Review
1165,"August 18, 2020",5.0,Cost-effective,"  The charging performance of this charging compartment is very good. It also supports Bluetooth. It also has a pop-up window. My headset can be used normally. It is almost the same as the original one. It is very easy to use. The price is very good. There are also small gifts. Nothing wrong! 1:1 box, just fit with the original protective suit, no gaps, fast charging, sufficient power, these two points are very satisfactory, praise is a must."
1166,"August 17, 2020",4.0,Apple wins again,  I purchased these airpods for my son and he loves them. I would’ve given 5Stars but they kept falling out of my ear.
1167,"August 17, 2020",5.0,My AirPods,  I love them so much
1168,"August 17, 2020",5.0,Great,  Great
1169,"August 17, 2020",5.0,Everyone needs these,  Birthday present for son he was happy he wanted it came the same day great buy
1170,"August 17, 2020",5.0,Battery life not great,"  They work good, but the battery dies very quickly. Friends’ who bought the same version around the same time last almost the whole afternoon longer (about four hours) while listening to the same things."
1171,"August 17, 2020",5.0,Good product,  Good product  take a long tome to come in
1172,"August 17, 2020",5.0,AWESOME. GOOD SOUND QUALITY,  Good price. Great Quality
1173,"August 17, 2020",5.0,Awesome,  Great. I like all of them.
1174,"August 17, 2020",4.0,Not sure if new,  Bought for my husband for our Anniversary. When he loaded them they said “Noah’s AirPods”. Embarrassing for a gift. Are these used?
1175,"August 17, 2020",5.0,Fantastic performance,  I had been resisting getting them for a while and then given the situation we are all in it became a necessity as Zoom and conference calls became the vein of our existnence. They are great on every call.
1176,"August 17, 2020",1.0,Preprogrammed with Bad language!!!,  Very unhappy these were for my 12 year old daughter and came named extremely inappropriate!!!
1177,"August 17, 2020",5.0,headphones,  They are OK
1178,"August 17, 2020",5.0,Good price!,  The air pods don’t fit snug in my ear so the hearing quality is a little altered
1179,"August 17, 2020",5.0,Makes an excellent Xmas gift👍👍,"  Great great great would buy them again. They improved everything, had last year models these are much better."
1180,"August 17, 2020",5.0,ease of use,  bluetooth connectivity
1181,"August 17, 2020",5.0,"BUY THESE , great price",  These are Great they are the exact Apple iPod you are looking for ! Bought 2 for my mom and dad
1182,"August 17, 2020",5.0,Awesome!!!,  Great product! Totally satisfied!!
1183,"August 17, 2020",5.0,Does the job,  Does the job
1184,"August 17, 2020",5.0,Muy buenos,  Calidad iphone
1185,"August 17, 2020",1.0,EMPTY BOX!,  Really bad experience! The untampered Amazon outer box came with an empty apple AirPods box. LITERALLY empty straight from the dealer. BEWARE!!
1186,"August 17, 2020",5.0,Fits my ear,"  I’ve tried other knock-offs , they were all too cumbersome for my small ears.  Apple AitPods fit perfectly, forget I’ve got them in sometimes ...and they don’t fall out Easily."
1187,"August 17, 2020",1.0,One earpiece no longer works - only have had ear buds for 4 months,"  That didn't last long. The headphone have not been exposed to water or sweat or any severe elements, yet one ear piece stopped a mere 4 months after I purchased it. I would have returned it for a replacement but apparently the window is closed. It's a shame that I've spend so much money on an unreliable set of headphones. I hope others don't have the same experience that I did."
1188,"August 17, 2020",5.0,Seamless pairing,  Very convenient since it pairs so seamlessly with my iPhone. Just got them and never going back
1189,"August 17, 2020",5.0,Recommend,  Great product very sturdy... amazing sound
1190,"August 17, 2020",5.0,Fast shipping,  Just what I needed
1191,"August 17, 2020",5.0,Great anniversary gift for husband!,"  My husband loved these, he works in a laboratory and this is helpful because the cables were in the way as he was doing experiments. He just forgets and walks too far away from his iPod and then the music stops. He solves this by keeping it in his pocket. He loves the sound quality and the lack of cables! The battery life is good."
1192,"August 17, 2020",5.0,Battery die fast,  Battery die fast In five hours like really in five hours 😭‼️
1193,"August 17, 2020",3.0,"These were Andrews, AirPods.","  I like the AirPods. I found ion connecting them, that they use to be Andrews AirPods. He no longer wanted them. He sent them in.  They were re-packaged, and sold as new. At least that was what the ad stated. Don’t sell it as new when it is used."
1194,"August 17, 2020",5.0,Birthday present that my wife loves! Excellent product,  Bought these as a birthday present for my wife. She absolutely adores them. She loves the carrying case and how they automatically work and uses them to talk on the phone. She’s happy so it’s a 5 star!
1195,"August 17, 2020",5.0,Great Price,"  Decided to give them a shot, glad I did. These are great"
1196,"August 16, 2020",5.0,Easy fit,  Easy connection solid case
1197,"August 16, 2020",5.0,THEY ARE REAL!,"  I bought these off amazon because they were $16 cheaper than the Apple store. I was skeptical about it being genuine but I checked the serial number on the Apple website to see if it was REAL Apple AirPods and I can honestly say that THEY ARE 100% completely real. They connected to my mom’s iPhone really quick and she loves them. They came clean, unopened package, and the audio quality was the same as MY own AirPod which I bought from the Apple store. I had to compare it just to make sure she’s getting the real deal cuz it’s my mom and I am glad I took the chance to buy these from Amazon."
1198,"August 16, 2020",5.0,gooood,  gooood
1199,"August 16, 2020",5.0,awesomeness,  Awesome  that you can use o e at a ti.e or both or even charge the box while using The buds
1200,"August 16, 2020",5.0,Music all day,  Amazing. Little sister loved her gift. she uses them every day all day. she couldn't be happier
1201,"August 16, 2020",5.0,Very essential,  Beautiful design and very convenient in airports and when working out.
1202,"August 16, 2020",5.0,Sound,"  Works really well, sound quality is amazing"
1203,"August 16, 2020",5.0,Easy to use and super comfortable!,"  I got these for my wife to use while running or working around the house. She loves not having a cord in the way and how simple it was to connect and set up these headphones. Our kids would get mad when she was listening to podcasts while being around them, but now she can do that without them knowing. Haha! She loves how much easier it is to use these while exercising because they are so compact and cordless.Only complaint is the lack of controls on the headphones themselves. Can’t really control volume or pause/play by touching the headphones."
1204,"August 16, 2020",5.0,"Great product, fast delivery",  I like the price and the speed of delivery. They sound good too!
1205,"August 16, 2020",5.0,Original Airpods,"  Original brand with unopened box, and nice price"
1206,"August 16, 2020",1.0,They don’t last long,  You might want to buy these somewhere you can easily return them like Costco. I received mine April 30th and by August the right air pod is done. I reset my settings and everything. Ridiculous price for how long these last.
1207,"August 16, 2020",2.0,Did not last more than 6 months.  Constantly fall out of my ears.,"  Mixed feelings on this item.  I have a pair that I have had for about a year and a half that still work well.  I only use them a few times a week, but other than the fact that they constantly fall out of my ears, I like them.  If I wasn't able to find the aftermarket silicone ear hooks that I need to use to keep them from falling out all the time, I would have returned them and give them a 1 star rating.  To be fair, I have small ears.  So, I would consider another option if you have small ears.  That said, this review is for a second pair I bought as a gift.  Unfortunately, after 6 months the right pod would not charge/work at all.  The left one would work, but only for about 20 min.  If fully charged and left in the charging case, both the case and the working pod would completely drain, which implies the batteries are not good in the case or the pod(s).  The person I bought these for didn't tell me about the problems until several months after she noticed it.  So, I had her give them to me and contacted Apple.  Support was really good and they tried to help me get them to work over the phone.  Unfortunately, no luck.  So, I asked what my options were to get them replaced or fixed.  They said they were out of warrantee and it would cost over $200 +$12 S&H to get them repaired.  I paid under $150 for them, so naturally all I could say was thanks for the help...  I guess I'll just throw these in the trash.  There are a lot of options out there that are a lot less pricy.  So, I will replace the gift, since I don't like to give a gift that is defective.  However, I may look at the Samsung or a couple of others that are out there.  Again, the ones I own still work fine.  This pair was obviously just a ""lemon"", but since Apple wasn't willing to do anything, I have a bad taste in my mouth.  Pretty disappointed with Apple.  Such good service, but won't stand behind their products.  Don't even get me started about the easy-break glass on their phones and pads."
1208,"August 16, 2020",5.0,I love these! 10/10,  I can’t say enough about these! If they are a good fit in your ear 10/10
1209,"August 16, 2020",5.0,Pricey but Amazing!,  My very first airpods.  Have always wanted one of these. Went with the first generation because I couldn't justify buying the airpods pro nor the second generation. I don't have a wireless charger so I wouldn't have been able to use that feature anyways. They came nicely packaged and connected to my iPad pro instantly. The sound so far sounds great. Still figuring out its features but so far I am impressed. I bought I case to protect my expensive new earbuds. For anyone who is curious the case is by i-Blason Cosmo series here on Amazon.
1210,"August 16, 2020",4.0,Great device,  I really like how easy it is to use and pair.
1211,"August 16, 2020",5.0,Love my AirPods,  Love them
1212,"August 16, 2020",2.0,Not impressed,  Wasn’t really impressed with the product for the money I spent on it.
1213,"August 16, 2020",5.0,Great value for the money,  Great product
1214,"August 16, 2020",5.0,Worth it.,  Better sounding than my wired headset.Probably not good good for an active sports activity.
1215,"August 16, 2020",2.0,Not great,"  These were replacement ones for my originals because my original set had issues with one pod connecting. These are far worse and I regret having my others replaced. 50% of the time they don’t connect when I put them in. They’ll show on my phone that they’re connected but there is not sound.  But when they actually work, they are good other than the battery life is worse than my original. I feel like I got a refurbished or used replacement because of the lack of quality."
1216,"August 15, 2020",5.0,Recommend,  Now I can watch my baby， and doing somethingElse. Clear volume.
1217,"August 15, 2020",5.0,Se escucha superrrrrr,"  Lo maximooooo, lo amo 😘😘😘🥰🥰🥰🥰🥰"
1218,"August 15, 2020",1.0,One pod died in six weeks - buyer beware,"  After less than 2 months, the right pod stopped charging. It will sit in a fully charged case for a day and come out with only 4% life remaining. Return window closed after a month so I spent  $130 for a product that doesn’t even last two months. Buyer beware."
1219,"August 15, 2020",5.0,As expected!,  It’s an Apple product! What else is there to say?
1220,"August 15, 2020",4.0,Good quality,  I really like these but they won’t play music at the same time for me. They both work and they’ll both play for calls but only the left or right will play music at a time
1221,"August 15, 2020",5.0,Warranty if lost,  Lost the right one within 30 days.
1222,"August 15, 2020",5.0,Love these,  Apple quality can’t beat it
1223,"August 15, 2020",1.0,Refrubished and Used Not New as stated,  Refrubished and Used Not New as stated
1224,"August 15, 2020",5.0,Air pods are awesome,  I love these!  They are my favorite phone accessory♥️
1225,"August 15, 2020",5.0,Overall very good performance,"  I received my AirPods for Father's Day.  They didn't appear to fit well, looked strange, and came in a case. i found that they had very good sound, fit well, and the case is very convenient for storage and charges the AirPods.  I use them daily with my Apple TV 4k.  It is a great product."
1226,"August 15, 2020",5.0,Expensive but good,  I haven’t tried an expensive alternative so I can only compare these to cheap knock offs and they just work. I love them
1227,"August 15, 2020",5.0,Great product,  Great product
1228,"August 15, 2020",5.0,Amazing awesome you name it it is it,   Worth the money! I love this product it is AMAZING! I never really like earbuds because the cord would always pull them out. One warning though! This Causes skin interior ration if left in too long. But other than that little heads up. TOTALLY WORTH THE MONEY!
1229,"August 15, 2020",5.0,Percept good shape,"  This came in perfect shape, brand new. :) EVERYTHING WORKS JUST FINE!"
1230,"August 15, 2020",5.0,Great,  Stays in ear.
1231,"August 15, 2020",5.0,Battery last forever,  Work great
1232,"August 14, 2020",1.0,Apple routinely and deliberately bends its customers over a barrel.,"  Apple likes to bend its customers over a barrel, stay away if you have any dignity. Whether it’s their faulty batteries or BS headphone/charger jacks just to make all their garbage I product’s obsolete, they’re r&d only works to screw the customer in fancy stupid colors. Scum."
1233,"August 14, 2020",5.0,Good,  Good
1234,"August 14, 2020",5.0,The sound quality was top notch,  Sounds good
1235,"August 14, 2020",5.0,Love them,  These are great. Love to be wireless.
1236,"August 14, 2020",5.0,work perfect,  they are very nice and work perfectly!
1237,"August 14, 2020",5.0,They work,"  They fit tight, they stay in, they have great sound. What else do we need? Oh they charge very quickly. I got two sets."
1238,"August 14, 2020",5.0,AirPods en Amazon,  Excelente
1239,"August 14, 2020",1.0,No air pods in box!!,"  I am extremely angry about this purchase!  I anxiously awaited this package as I accidentally washed and dried my son's air pods.  The package finally arrives (1 week after ordered Amazon Prime) and the only thing in the box was a charging cable!!!! No air pods at all!  Are you kidding me, Amazon?  Either you have a thief working for you or you think you can rob me!  The box was torn on one end.  I was okay with that but then I opened it and it was empty cardboard inside with a charging cord underneath.  I didn't even order a charging cord.  I could not be madder!!!!!!!  I would give it a negative 1,0000000000000000 stars!!!!"
1240,"August 14, 2020",5.0,Great product,  Cool little headpohones
1241,"August 14, 2020",5.0,Perfect,  Absolutely perfect and I added the apple care son my son is good great buy and was a little cheaper then other places I looked .
1242,"August 14, 2020",5.0,Great for multi tasking,"  This was given to me as a gift from my children. Due to covid-19, I am working remotely from home. The airpods allow me to multi task while talking to clients. I love them."
1243,"August 14, 2020",5.0,Good quality! Good price! Quick delivery!,  Works great! Good quality!
1244,"August 14, 2020",5.0,N/A,  Works great ! VERY RECOMMENDED
1245,"August 14, 2020",5.0,Perfect,"  I love them, glad I decided to buy!"
1246,"August 14, 2020",5.0,What a helpful Item!,  AirPods are easy to sync and intuitive to use.
1247,"August 14, 2020",5.0,Super great sound quality and battery life.,  Simply great. Love them.
1248,"August 14, 2020",1.0,Don't buy!,  They worked great for the first few months but then started having to charge a little more often and now I get people saying they can't hear me. I bought these for work as I speak with a lot of provider offices but since they seem to be going in and out I can no longer use - definitely a waste - I will stick to buying from Apple directly as they stand behind there products regardless of time
1249,"August 14, 2020",4.0,Great headphones,  There’s a tiny scratch on the front of case but not really visible unless you put a light on it. Works well. Charges well.
1250,"August 14, 2020",3.0,Not easy to hold on ear,"  The surface is too smoothly, not easy hold on ear,i bought for my wife,it always fall down,finally she missed one pods.And it is expensive ,just because it is 🍎, i think is not valuable."
1251,"August 13, 2020",5.0,User friendly,  Syncs very easily to devices. Love it. Quality great
1252,"August 13, 2020",1.0,Beware of fakes,  Received fake airpods. No serial number inside the airpods charger.
1253,"August 13, 2020",5.0,👍🏽,  In time
1254,"August 13, 2020",5.0,As expected.,  Excellent
1255,"August 13, 2020",5.0,Bello,  Excelente producto justo. Tiempo ✨
1256,"August 13, 2020",5.0,Tienes q ordenar,  Muy buen artículo me gusto mucho
1257,"August 13, 2020",5.0,Battery life not very long,  Battery life didn't last longGranddaughter had to wait for them to charge up. Not a upper camper
1258,"August 13, 2020",5.0,I love it,  Perfect gift for my wife
1259,"August 13, 2020",2.0,Make sure you keep track of the serial number,"  I was using my AirPods on a work call at the grocery store and the AirPod case accidentally fell out of my pocket. I was unable to find it and when I contacted Apple to replace the case, they informed me that I needed the serial number, which is written on the case, to replace the case. The serial number wasn't on the invoice from Amazon and so unfortunately, I'll have to purchase an entire new set of headphones. Frustrating experience. Lesson: either make sure you don't lose the case or make sure you have the serial number saved someplace."
1260,"August 13, 2020",5.0,My life is complete now!,"  Greatest earphones ever!I don’t know how I ever lived without these, seriously, not just the earphones but the great little case that they come in that charges your ear buds even when it’s not plugged in so perfect to have when you’re traveling.The ear buds not only allow you you to  call people by simply saying “hey Siri” but it answers any questions, it reads and composed text messages if I ask, it plays music etc. etc.  Simply ask and you shall receive.I can now cook with my hands full while dancing to the beat of any song I ask Siri to play, ask Siri to take notes for me or even help give me recipe ideas.Once you’ve used these you will also ask yourself how you ever lived without it as it makes your life so much easier.The sound is fantastic  along with the noise reduction and whomever I’m speaking with hears me well.These are pricey but I assure you they are worth every penny you pay."
1261,"August 13, 2020",3.0,They're OK. I wish I bought them elsewhere though.,"  I was hesitant to purchase Airpods because of the steep price so when I saw there was a deal a few months ago (early 2020) I hopped on the bandwagon! Since I have many Apple products, these DO make it easier to sync up to my Macbook, iPhone and iPad. However, even with that being the case the airpods I received were defective. I spent hours talking to customer service and at the Apple Store (pre-COVID) and they ended up having to replace the case and one of the airpods. At times I still have issues with connectivity and the microphone isn't the greatest. Sometimes my airpods would be in the case and I wasn't trying to connect to my phone yet the music would play WHILE THEY WERE IN THE CASE. I even reported this to the apple care team and my customer service representative told me it was something they'd never seen or heard about before. (Seriously wish I was making this up, I just wanted to be able to have wireless earbuds).I'll admit that I don't fully regret my purchase, but regret buying it via Amazon instead of from the Apple Store or a major retailer (i.e. Best Buy). Not sure if my logic makes sense, but I feel like there would've have been less of a chance of getting a faulty item.TLR; Airpods aren't a bad investment, but be wary and monitor your item if you buy it via Amazon. ALSO they aren't noise cancelling and the microphone isn't the greatest. The sound is OK but if you want to still spend a good amount of money, you probably can get better quality headphones elsewhere. The best feature to me is that it is super connected with my apple products and I can tap to change the songs, etc."
1262,"August 13, 2020",1.0,E,"  This product is shoddy. There is so much break in sounds it is ridiculous. I am better offUsing the regular wired headset. I tried everything including charging the Apple  AirPods overnight thinking that may be the problem. Of course to no avail. I got tired of  the pods that I left them  on the shelf. Of course when I called Amazon, they called Apple and referred me to Apple Customer Service instead. Sorry I bought this poor quality product. I may have been better off with Chinese “ knock off” version, if such is on the market"
1263,"August 13, 2020",4.0,Not impressed,  My daughter was pressed to get these so we got them for her for her birthday.  The sound is basic and the battery life sucks.  Overpriced for sure....you’re paying for the Apple logo...lol
1264,"August 13, 2020",3.0,Battery life is horrible,"  There are some good things about them, but the battery life is so short. I have to charge them multiple times a day."
1265,"August 13, 2020",5.0,N/A,  Nothing I dislike
1266,"August 13, 2020",5.0,Awesome sound,  Amazing sound and quality! They fit great and stay in perfectly.
1267,"August 13, 2020",5.0,Great wireless headphones,"  Excellent sound quality, comfortable enough to wear for a long stretch without discomfort, easy to pair with any bluetooth device.  I use them mostly on the phone or video calls working from home, and when I am out and about listening to music.  Very happy with this purchase!"
1268,"August 13, 2020",1.0,Please don’t buy from this company,  My air pods looked like they were used and they didn’t work in the other ear. Please do not get these AirPods I was scammed for my money.
1269,"August 13, 2020",5.0,Apple AirPods with Wired Charging Case-Prod Review,"  Good & would recommend, been using this for a while and is very impressive"
1270,"August 13, 2020",5.0,If you’re the type of person who will keep,"  They actually sound really good I was surprised. It’s just after couple hours of usage your ears hurt, but after that really recommended."
1271,"August 13, 2020",5.0,Works just like a new apple AirPod. Worth it.,"  Did not come with charger cord for the case. It is worth it for the price though, everything else works so it’s not bad at all."
1272,"August 13, 2020",5.0,Excelente servicio,  Súper cómodo muy buen sonido se los recomiendo
1273,"August 13, 2020",2.0,Came used,  LOL! Came disgusting dirty as if used & left ear did not play music or charge at all. You get what you pay for. Next time will buy from Apple store
1274,"August 13, 2020",5.0,Air Pods,  I like to use my air pods to talk on my phone.  I like using one at a time.  I can hear very well with these.  The voices on the other end are very clear.  I am very happy with my purchase.
1275,"August 13, 2020",5.0,That's what I need,  👍👍
1276,"August 12, 2020",5.0,Good,"  Great headphones, I wanted airpods for awhile and had to grab these when they went on sale."
1277,"August 12, 2020",5.0,Great!,  Well packed. Perfect condition
1278,"August 12, 2020",5.0,Love these!!,  Love these!!
1279,"August 12, 2020",5.0,Makes it so simple to be on the phone,  Love it
1280,"August 12, 2020",5.0,AirPods worth having,  Easy to use
1281,"August 12, 2020",5.0,I love them,  This is a very good product. They have very good battery life and have good sound quality. I take them any were I go to work on a long car ride or even hiking in the mountins. they dont take long to charge and they can last up to 35-45 hours of use. over all a good product I would buy again.
1282,"August 12, 2020",5.0,Order these!,  The AirPods are bomb! Our package was mixed up with someone else’s and they sent a replacement order in 1 day!! So amazing thank you!!
1283,"August 12, 2020",5.0,The real deal,  Arrived in perfect condition no complaints here!
1284,"August 12, 2020",5.0,Love these!,  Never thought I’d use something like this - but use them everyday! They stay put in your ears also - never worry about losing them. 😀
1285,"August 12, 2020",1.0,Not reliable,"  I’ve had 4 replacements within a year! Not worth it at all, would not recommend!"
1286,"August 12, 2020",5.0,Super fast shipping and great product,  Shipped really fast! Definitely happy with my purchase!
1287,"August 12, 2020",4.0,Much better than Skull Candy,"  Paring the earbud is extremely easy.  Took them out of their case and I was asked if I wanted to pair them with my phone, said yes and they paired and named in one button push.  Was disappointed to find that there is no volume controls on the buds, need to adjust the volume on my phone.  Sometimes it’s difficult to transfer a call to the buds. It’s not as easy as just choosing the buds from the drop down list.  I had to Cycle my phone off/on and call somebody back to Get to work.  Over all satisfied with product"
