Index,Date,Stars,Title,Review
3550,"May 23, 2020",5.0,The perfect tool for WFH,"  Day 2 of my WFH experience I realized I needed wireless audio capability to be more effective on video and audio teleconferences.  With meetings usually lasting one hour, and my schedule often having back-to-back meetings, it would be nice if the battery life were a little longer than the 3 hours. However, understanding that batteries add weight, and current technology is what it is, I'll go with bluetooth airpods any day! Just remember to park them in the recharger module between meetings so you don't have to switch to wired audio. These also work well when you're WFH with a significant other and you both need your own professional space, even if in an apartment."
3551,"May 22, 2020",5.0,Great sound!,  They work really good! I recommend this product.
3552,"May 22, 2020",5.0,They Came quick,  There great my friend loves them go ahead order from this vendor there great
3553,"May 22, 2020",5.0,Great sound,"  Great sound quality. However, the battery does not seem to last all day. Also the pods can accumulate lint, which obliterates and sound and has to be removed with a brush. I bought and use the OXO Good Grips Electronic Cleaning Brush."
3554,"May 22, 2020",5.0,Apple quality.,  Love it.. worth the purchase.
3555,"May 22, 2020",5.0,They stopped working without much use.,  We barely used them and they stopped working after 4 months. I would like them replaced if possible.
3556,"May 22, 2020",1.0,Empty box delivered,  My order was just delivered and it was a Empty box like someone opened it and closed it back. I’m very upset this was for my daughter birthday gift tomorrow and now what. Can someone please contact me
3557,"May 22, 2020",5.0,satisfied,"  the delivery time, i love it. thank you!"
3558,"May 22, 2020",5.0,Love them,  Worth the money for sure
3559,"May 22, 2020",3.0,Battery life in question,"  I really wanted to like these and in many ways I do. They sound good. But I don’t think I’ll like them for long. I just charged them for the 3rd time. They were plugged in, in the case, for 2 days and only charged to 91%. A 9% loss in a few weeks is a lot. So I guess I won’t be liking these for too long."
3560,"May 22, 2020",3.0,Ouch,"  These hurt my ears sooooo bad. I have small ears, but I’ve never had any other headphones that go in my hears hurt like this. They are so uncomfortable I basically have to force myself to wear them. That said every other feature they advertise is dead on."
3561,"May 22, 2020",5.0,The best,  I love them so much they works great with calls and music too great  buy
3562,"May 22, 2020",5.0,Great sound quality,  Awesome easy to use
3563,"May 22, 2020",5.0,Stop buying something trying to get these...,  I have tried to avoid spending the money for Airpods and then I broke down after a pair I bought weren't loud enough to cover the music being played at my gym.  I bought these and really couldn't be happier.  They fit well and are loud enough where I can play what I want to listen to without hearing other music.  I also noticed I was able to walk a pretty good distance away from my phone without issue there as well which is nice!  I wish I would have broken down prior and just spent the money.
3564,"May 22, 2020",5.0,Brand New,  As described
3565,"May 22, 2020",5.0,High quality,"  Very satisfied with this item, bought it for my daughter's birthday. Sound and design are excellent."
3566,"May 22, 2020",3.0,Features are good but not very reliable,"  When the AirPods are working, they work great! However, there have been so many times when one headphone doesn't work despite my phone showing both being fully charged. I end up having to reset the AirPods every time this happens, which happens quite often, making them very annoying to use."
3567,"May 22, 2020",5.0,Great!,  Better than expected.
3568,"May 22, 2020",5.0,Finally in the loop,"  Apple's headphone design is the only design that I am able to wear for extended period of time.  So when I was able to afford the AirPods, I bought them.  They are great."
3569,"May 22, 2020",5.0,Love these!,"  I had to purchase these after my previous cord ear buds went out. Was reluctant because of the price. But they are proving to be worth every penny! The sound quality is amazing. If I get a phone call, even when outside and I have these in I can hear the caller very clearly and have been told my voice is very clear coming through. Highly recommend these!"
3570,"May 22, 2020",5.0,Nice,  As far as I know these are the real air pods.They work great.
3571,"May 22, 2020",5.0,Airpods,  Love it
3572,"May 22, 2020",1.0,My AirPod where missing,  So when I opened my amazon box I found my  AirPod box already open with only a charger wire super mad about it
3573,"May 22, 2020",5.0,—,  I love them! They charge fast and last quite a while. They are authentic if anyone is wondering it came in the original box and with everything inside.
3574,"May 22, 2020",5.0,No headline 🤣,  Great product. Love Apple & amazon 💓
3575,"May 21, 2020",5.0,Amazing!!!!,  Apple products never fail to amaze me. These are great!
3576,"May 21, 2020",5.0,Awesome,"  I love them , make having corded head phones seem so old and inconvenient ."
3577,"May 21, 2020",5.0,Good stuff on apples part,"  Came brand new amazon tried delivering them at 4am for some reason?? But they sound great, loud as hell, pretty good price! Just be careful as when I finally got the box it wasn’t secured at all just the sealed box inside the cardboard box no packing peanuts or the abomination knows as the unpopable bubble wrap. 9/10"
3578,"May 21, 2020",5.0,Great,  Love them
3579,"May 21, 2020",5.0,Buenísimo,  Buen trabajo
3580,"May 21, 2020",3.0,how do I return the airpods,"  I am very disappointed with the airpods. they have terrible battery life and don't keep the charge. I would like to return them.for the amount of money i spent, I am very disappointed"
3581,"May 21, 2020",4.0,Good but expensive,"  I’m an Apple guy but after losing one of my ear buds, I purchased a $40 pair and I will never pay $150 for ear buds again.  Not that this is a bad pair but the difference between this $150 pair and a $40 pair is negligible."
3582,"May 21, 2020",5.0,Best,  Best
3583,"May 21, 2020",5.0,Great for the apple enthusiast,"  My wife wanted overpriced apple earbuds..pardon me airpods, and these were a tolerable price point. Great functions and decent mic pickup though i will admit."
3584,"May 21, 2020",5.0,My kiddos love them!!,"  Bought 2 pairs for my kiddos. They absolutely love them!! My son did say, he wished they had a longer battery life."
3585,"May 21, 2020",5.0,Worth the hype,"  Super easy to use and toggle between my iPhone and MacBook. Comfortable, good sound and mic quality. Worth the investment"
3586,"May 21, 2020",5.0,Great product!,  I love the AirPods so far. They have great sound obviously they are cordless so that’s great not having a cord in your way while working out or taking a jog.
3587,"May 21, 2020",5.0,Everything was wonderful,  Wonderful😄
3588,"May 21, 2020",1.0,New out of box and didn't work.,  Bought these new and the right AirPod didn't work.  Returned next day.
3589,"May 21, 2020",5.0,I love my airpods,  I love my airpods! Brand new in case! The real apple brand!
3590,"May 21, 2020",5.0,Took too long to arrive,  Great product. It took 9 days for this to arrive which was way too long. I bought these as a gift for my wife and I had a hard time stalling. I get the whole convid 19 thing but geez.
3591,"May 21, 2020",1.0,Doesn’t stick to the ear - Waste of Money,"  The quality of the sound is great, but it’s not recommended if you are planning to use it for running. In my very 3rd time running using it the right pod fell from my ear direct under my feet and didn’t resist. Very fragile. Wish I had bought the new model."
3592,"May 21, 2020",4.0,Works extraordinary for  small ears,  Excellent battery life. Best in the class but design is flawed which makes it fall off sometimes. Works for small ears
3593,"May 21, 2020",5.0,I received them,  There dope
3594,"May 21, 2020",2.0,Meh,  They were good and then they started acting up when I tried to call someone
3595,"May 21, 2020",4.0,Pretty good,  Sound quality is good but not nearly as good as a set of headphones. Good for working out and day to day activities.
3596,"May 21, 2020",1.0,Range Sucks,"  Let me start this review by saying that I'm using these pods with a Blackberry Priv that has an Android OS, so take that FWIW.  Maybe they aren't compatible, or optimally compatible, or whatever since they're an Apple device.  I don't know, but the point of having them is to be able to listen to my phone without wires, and they don't allow that very well.The range is limited, like less than a few feet, and depending on where I'm using them it's less than that.  For example, I can be at the gym on an incline bench, set my phone on the floor next to me, and the podcast that I'm listening to cuts out. Maybe there's interference from the gym's piped in music - they work well enough when they're about 10 inches away from me in the rack on the elliptical machine.This afternoon I was washing my car in my garage.  When I was washing the tires I left the phone on the hood of the car, and when I went to wash the rear tires, my podcast cut out.  I ended up turning them off them and using the speaker in the phone.The only time these pods really work is when I'm driving and I have my phone on my lap.  YMMV depending on how, when, and where you use them."
3597,"May 21, 2020",1.0,Is not original AirPod from Apple,  Wasn’t the original AirPod from Apple and it says in  here is from Apple but is not it looks China to me
3598,"May 21, 2020",5.0,Love love love,  I love these. I attempted to buy some knock offs on Amazon several months ago and they didn’t work at all. These are amazing (my first pair) and I love everything about them.
3599,"May 21, 2020",1.0,"Poor quality, inferior product","  Bought this product late Jan. At first, it worked fine. Later, only one of the ear buds works. Worse investment I’ve made."
3600,"May 21, 2020",1.0,F This,  THE BOX WAS EMPTY.
3601,"May 21, 2020",5.0,Reliable,  Great
3602,"May 21, 2020",5.0,Super excited!,"   Great purchase! I’ve been wanting these for a long time, so great to have them now!"
3603,"May 21, 2020",1.0,Don’t buy! Its work less than 1 year!,  Less than 1 year its stopes work!
3604,"May 21, 2020",5.0,Highly recommended,  I wanted these for a very long time just never had the money and my bf bought them for me. Made me so happy
3605,"May 21, 2020",5.0,Worth the price.,  It’s a really great product and great for noise cancellation with excellent sound quality.
3606,"May 21, 2020",1.0,Amazing Sound Quality but Some Cons,"  Update: I've had these for six months and the case has stopped charging. They are essentially useless now. I would recommend purchasing through Apple so you can get another pair if yours malfunctions. Since I purchased on here and the return window is closed, I cannot get another pair, which means $130 down the drain.This was definitely one of my best Amazon purchases. The sound quality on these is amazing even during phone calls. The charging case holds an impressive amount of charge so I only need to recharge it once every 2-3 days, which isn't very much considering I use these 8-10 hours a day.at work. That being said, there are some cons to these. The battery life of the AirPods themselves isn't the best-- you'll get 1-2 hours max. Now, five minutes in the charging case will get these back to full charge, so take that with a grain of salt. The biggest con for me has been the Bluetooth connectivity. I have an IPhone 11 so I would expect these to have no issues with connecting. However, every few times I use these, one or both of the AirPods does not connect when I pull it out of the case. It usually takes about five minutes to figure out the problem and re-connect them. It's definitely a problem when I'm trying to pick up a call on my AirPods or listen to something quickly. For that reason, I'd give these 4/5 stars. They're still worth the purchase but I'd recommend adding AppleCare so you can get a replacement if you have the same issues. (P.S. If you have an Apple watch, these do not connect independently to the Apple Watch, you will need to have your IPhone on you.)"
3607,"May 21, 2020",5.0,Perfect,  Received a week before I was supposed to!
3608,"May 21, 2020",1.0,Scam,"  don’t trust it they scammed me ,only gave me a charger not the air pods ."
3609,"May 21, 2020",5.0,Fast Shipping Great Price,  Son loves these. they are awsome
3610,"May 21, 2020",5.0,great,"  great product,  nice charging capabilities and holds a charge"
3611,"May 21, 2020",5.0,Nice,  Nice item
3612,"May 21, 2020",5.0,Extremely pleased with my purchase.,"  I bought these for myself, it was my birthday gift. The quarantine just started and I couldn’t leave my home and I really wanted AirPods. The price was right and they came in perfect condition. I use them everyday! This is the best birthday first I have ever purchased! I will buy from this seller again. Thank you!"
3613,"May 21, 2020",1.0,Probably refurbished - bad quality / lot of issues,  Probably refurbished -1. Initially I noticed the case didn’t have a smooth click but chose to ignore2. But slowly so many issues kept coming back that includes that *battery life is very low*3. Now half the time they *don’t connect to my phone*4. Or if they connect *I don’t hear anything*
3614,"May 21, 2020",1.0,Made in Communist China,  Did not like that it is made in Communist China
3615,"May 21, 2020",4.0,"Eh, apple products are so overrated.","  Works good so far. Bought them to use for online classes to use with my android. The tapping part isnt really all that sensitive, and my hair will rip the buds out of my ears, so I have to keep putting it up to use."
3616,"May 21, 2020",5.0,Love them!👍🏻😊,  I bought then for my daughters one at a time (4 ) then me then my mom for mothers day. We’re all happy👍🏻😊
3617,"May 21, 2020",5.0,Yes,  I Love these I can’t go anywhere without them!!! The battery life start going down after a few months of having them but before then they were perfect! Sound is clear and it doesn’t feel like anything is on your Ear is the nice part! Just pay attention to a lil breeze because tht means they may have dropped out!
3618,"May 21, 2020",5.0,Can’t live without,"  The real deal. I really can’t live without these to be honest. Beside my phone and wallet, these are the main things I need whenever I leave the house. I am doing things by myself a lot and I am a person with feels at ease when I go out in public listening to my own music or a podcast. A game changer for sure."
3619,"May 21, 2020",5.0,Durable with good quality,  Even dropped on the floor carelessly for many times，still work well，it's worthy of the price.
3620,"May 21, 2020",2.0,Sucked,"  I was very excited to get these air pods and when I got em, everything seemed fine for the fist week. On the second week of having them The left one stopped working?! I took really good care of them so there were no reason for that happening. And the case was a little funky when it first arrived too."
3621,"May 20, 2020",5.0,Excellent Connectivity,"  I have several sets of wireless earbuds, and I noticed that each set worked best at different tasks. One pair would work well for music another for videos, but no set I had would do well at both. I was hesitant to purchase these because I was worried that they would have the same problem, but they work great at everything I use them for. The only problem I have with them is that they are so comfortable that I forget that I’m wearing them until they run out of battery, which is faster than I would like but quite adequate for my use."
3622,"May 20, 2020",5.0,Great Gift,  My son enjoys this product. It’s been five months with no problems.
3623,"May 20, 2020",5.0,Great gift!,  Bought these for my mom and she loved them! They work great and are perfect for everyday use.
3624,"May 20, 2020",5.0,Happy customer,"  They are exactly what they are supposed to be. Easy to use, good sound quality and convenient to take on the go. Use one or both depending on the need."
3625,"May 20, 2020",5.0,Survived full washer cycle!,  I forgot to remove them from my pocket after my run today. Later found them on the bottom of the washer (without the charging case). I knew they were not waterproof...Let them dry for 12 hours hoping they might work. And they did!!! Working as if nothing happened! Amazing!
3626,"May 20, 2020",5.0,Guess I wasn’t as lucky as others.,"  Took the chance on these bc of all the great reviews and I love all my Apple products. That being said, I feel like I got faulty AirPods. I love them ... when they actually work. I’ll get a call and put them in my ears but it won’t work every time. Sometimes I’ll get a clicking in my ear when I’m on a call or when I’m listening to music. I can’t exactly buy another pair so I’m stuck with these. Just a disappointment."
3627,"May 20, 2020",5.0,perfect,  my son love it
3628,"May 20, 2020",5.0,Authentic,  Good product
3629,"May 20, 2020",5.0,Love them!,  N/A
3630,"May 20, 2020",5.0,Great,  100% authentic I ordered these and got them the same day
3631,"May 20, 2020",5.0,THEY ARE GREAT!,  These are amazing and they charge really fast and the battery lasts you a while unless you are constantly making phone calls or listening to music. But overall the battery lasts you a long time.
3632,"May 20, 2020",2.0,Quality goes downhill,"  The airpods are nice at first but the quality goes down pretty fast. Overtime they have gotten quieter and quieter, you can barely hear anything out of the left headphone. They often glitch and make a lot static noise and won’t play the actual music."
3633,"May 20, 2020",1.0,Need back my earplugs,  Someone stole the earplugs  from the package
3634,"May 20, 2020",5.0,Definitely will buy again,"  Works just like AirPods, stay charged, love the sounds, very loud, I use them all the time"
3635,"May 20, 2020",5.0,love it,  came early very good
3636,"May 20, 2020",5.0,Loved these,  Works awsome!
3637,"May 20, 2020",5.0,Love mine,"  Don't listen to the haters, these are the real thing and they aren't used either."
3638,"May 20, 2020",5.0,Super Good Quality Headphones,"  Came in a nice package, very quickly. Neat and slick design of the headphones. Do not fall out when exercising, good sound quality, connect supper quickly to my IPhone 8! Overall epic product and I recommend it to people who don’t have wireless headphones yet! T"
3639,"May 20, 2020",5.0,Quality item,  Great product
3640,"May 20, 2020",5.0,User friendly,"  The best thing I liked is the ease of pairing process with my iPhone. It did not require any passwords or any extra steps. I just tapped the settings and the AirPods menu popped up. The quality of the sound, connection has been high as expected."
3641,"May 20, 2020",5.0,Perfect,  THERE 100% real and perfect
3642,"May 20, 2020",5.0,Best headphones I've ever owned,"  I didn't really want to get AirPods, but I ruined my Bose sound-sport free wireless by leaving them out in the rain. I got these and didn't expect the sound quality to be so good! Not noise canceling, but they don't claim that. It's hard to hear sounds around you when you turn them up a bit, but the quality of sounds is so good! They were a bit uncomfortable in my ears at first, but then I learned you don't push them in as much and let them sit in the contours of your ears. They don't fall out at all, which was surprising, even when I run. My favorite feature is that they pause my music when I remove one. I think they're probably the best headphones I've ever had and I'm sad I took this long to order a pair! I'd highly recommend to anyone!"
3643,"May 20, 2020",1.0,Returned Defective Item,  I  returned defective item to Greenbrier Hub in Chesapeake Virginia.  I have email that I returned item.  It has been two weeks and I am now getting emails that my account will be charged due to not returning item that I returned.Unable to speak to anyone to explain the problem.
3644,"May 20, 2020",5.0,Ipods Changed our Life,"  My teen son for some reason loves to listen to his iPhone on LOUD! while we as a family are watching tv.These have changed our lives, thanks APPLE"
3645,"May 20, 2020",1.0,"Plastic, fake, non-Apple feeling",  Fake feeling. Lighter and more plastic than my previous Gen1 AirPods. Returned and refund went fast.Opposite to a normal Apple experience.
3646,"May 20, 2020",5.0,Great quality,  Ordered for my grandson’s 15th birthday and he thinks they are awesome.
3647,"May 20, 2020",5.0,Official,  Great!
3648,"May 20, 2020",1.0,Bummed.,  Battery doesn’t last and the right one flew out of my ear while on a jog and exploded into 1839 pieces.Not worth the money.
3649,"May 20, 2020",5.0,Perfect,"  Perfect fit running, cleaning, really anything"
3650,"May 20, 2020",5.0,Great for the price,  Sound great delivered fast
3651,"May 20, 2020",5.0,Great buy,  Just got them a couple days ago .i love them. So far so good ..
3652,"May 20, 2020",5.0,Awesome,  I love these. They charge super fast. Overall they're just awesome.
3653,"May 20, 2020",5.0,Muy bueno,  Excelente producto siempre utilizo apple y se que es duradero
3654,"May 20, 2020",1.0,Disappointed,  It was evident that I was sent refurbished ear pods. The right side did not work and when activated someone else’s name appeared on my phone.
3655,"May 20, 2020",5.0,These are such a great investment!,  I have had these going on 3 months now and I love everything about them. They were easy to connect and they are very convenient when it comes to multitasking while talking on the phone! I can't see myself ever using regular headphones again!
3656,"May 19, 2020",5.0,Absolutely love them,"  Best pair of headphones I’ve ever bought with no cords lightweight exceptional sound exceptional bass just with adequate battery life, track changing with a double tap excellent noise cancellation"
3657,"May 19, 2020",5.0,Best invention ever!,  Love these. My teenage son told me these were a must and he was right!
3658,"May 19, 2020",4.0,Great hand free listening.,  Product works well. Battery life could be longer.
3659,"May 19, 2020",1.0,Not *NEW*,  I purchased these under the guise of them being New and genuine from Apple. Since the Apple link is iN the tittle for the product. The AirPods I received are refurbished. Apple won’t help me at all. Amazon tells me to contact Apple.
3660,"May 19, 2020",3.0,Over rated Apple airpods,  They are just ok.  Apple products are overprice for what you get.  I wish the battery life was better and it had better noise isolation.  There is a lot of sound bleed and other people can hear what I am listening to when my volume is up.
3661,"May 19, 2020",1.0,Empty box,  Got my airpods and NOTHING is in the box
3662,"May 19, 2020",5.0,Everyone needs it,  My second pair.
3663,"May 19, 2020",1.0,Earwax in airpods,  Airpods came in a box with the parts scattered everywhere and both airpods have earwax in them.
3664,"May 19, 2020",5.0,PEOPLE MUTERS,  DONT LIKE TO LISTEN TO PEOPLE .
3665,"May 19, 2020",5.0,Loved them,  She loved them
3666,"May 19, 2020",5.0,Brand new untouched unsealed!,  Perfect in sealed unopened brand new Apple AirPod box. Works and sounds great! And fast shipping!
3667,"May 19, 2020",1.0,These are NOT new.,"  Apparently they once belonged to someone named Pesi or something. They arrived outside the Apple box inside the Amazon box without any popcorn or bubblewrap. Also someone took out the apple stickers. They work fine I guess, but these are not new."
3668,"May 19, 2020",5.0,not bad,  not bad
3669,"May 19, 2020",5.0,10/10 Recommend This Product!,"  10/10 recommend this product! Before I got this I was scared because there was some bad reviews, but I’m so glad I still got it! The good reviews our way the bad one for a reason, these AirPods are 100% real and they sound amazing, I’m so glad I got them!!"
3670,"May 19, 2020",5.0,no cord,  You can go through out our home listing to what ever you like and have the phone in one place and receive the broad cast. They work great.
3671,"May 19, 2020",5.0,Best purchase so far,"  These Airpods came in brand new as expected. I got these for my girlfriend since she got me some so I had to return the favor haha. They have an amazing sound quality and they connect to your phone almost right away. It’s a little more difficult for people like me who only use one side most of the time since sometimes they won’t catch that it’s in your ear but they’re still great products.The charging speed of Airpods is INSANE, you can fully charge them in like 30 minutes. When your Airpods die you can put them in the case and they’ll get charged most of the way in like 10 minutes and they still last a long time before having to charge them."
3672,"May 19, 2020",5.0,Good!,"  These are great! If you’re looking for noise cancellation these aren’t it though. They work great, but if someone else is on the phone next to you, you will hear them no matter how loud you make your earbuds. These aren’t for noise cancellation they pros are."
3673,"May 19, 2020",5.0,Awesome!!!,  The sound is amazing and when talking on the phone I can be heard clearly. These are really great head phones. About 3 hours talk time and pairs with Apple or android devices.
3674,"May 19, 2020",5.0,Worth the price!,  Love apple products and these did not disappoint. Great sound quality and came very fast!
3675,"May 19, 2020",5.0,It’s easy with the connection,  I love these they are the best
3676,"May 19, 2020",2.0,10 bugs stuff,"  if you donot care the sound quality, this is the one to buy."
