Index,Date,Stars,Title,Review
0,"October 7, 2020",4.0,Only works on Apple Products,  Doesn't work on any Bluetooth phone. I got it for my iPad and my phone.
1,"October 7, 2020",5.0,Great stuff,  These work great with my I phone and good delivery as well
2,"October 7, 2020",5.0,Very good!,  Cane is the box very good
3,"October 7, 2020",2.0,Not new,  Opened it for the first time and Bluetooth’d to my daughters phone and it says “daddy’s AirPods”These were told they would be new.... they obviously aren’t.
4,"October 7, 2020",4.0,How they work,  my left airpod kept getting low so i returned em & got new ones but my left one still low asf but they ight tho
5,"October 7, 2020",1.0,I got bad Apple ear pods.,"  My right ear plug stopped working and charging too . I really have no use for them now, so what do I do with them, just stare at them. I thought I had a warranty on them but nobody is helping me so HELP"
6,"October 7, 2020",5.0,Great earbuds,"  Purchased AirPods for my wife, she really likes them a lot and I got them at a great price thanks to Amazon Warehouse.  The sound quality is adequate for the design, depending on the sound quality you are looking for may want to step up to the pro model or check out the Powerbeat Pros as an alternative.  Overall we are happy with the purchase."
7,"October 7, 2020",5.0,Handy to be wireless,"  It's great to cut the wires, welcome to 2020."
8,"October 7, 2020",5.0,Good quality,  Good quality
9,"October 7, 2020",5.0,Perfect!,  Love them I use them every day!
10,"October 7, 2020",5.0,Great buy!!!,  I loved it and I will buy again
11,"October 7, 2020",2.0,Stopped working after 7 months,"  I got these Airpods in late March 2020. I went to use them today, Oct 2020, to make a call and my cell was not connecting. I've shutdown my cell, plugged the Airpod cord to another outlet, pushed the button on the back of the airpod case, and tried to connect with another cell phone and nothing worked. The light on the case never would come on. I keep the case plugged in most of the time and it's generally charging every day. Now, I'm going to have to find an apple store so they can see if it's defected. I would be livid if I lived in a small town that had no apple store. Hopefully, my experience with this at the store will be a good one as it's been less than a year since I've purchased these."
12,"October 6, 2020",5.0,I love them,  I love them
13,"October 6, 2020",4.0,Stay in my ears,"  Earbuds with the rubber tips have never fit my ears very well — they either fall out easily or hurt after a while. But Apple’s wired earbuds have always fit way better for me, and the same is true of the AirPods! The sound quality is good enough for listening to music or watching a tv show. I wouldn’t do music production or sound mixing with them, but that’s not really what these are for anyway.The new IOS 14 update makes these MUCH more convenient. When switching between my iPad and iPhone, the airpods seamlessly switch over automatically."
14,"October 6, 2020",5.0,Perfect and I don’t say that about anything,"  These things are sooooo money. Sound great, don’t fall out and look cool. Don’t even look at others your just wasting time that you could be listening to you tunes. Buy it"
15,"October 6, 2020",5.0,"YES THEY ARE 1st GEN, but they are still great!","  I bought these to use at work instead of my over the ear beats because wearing those huge headphones isn’t a great look at work. I wasn’t expecting them to sound amazing, but the sound quality is comparable to my beats that were 3x the price. They are definitely by apple; I’ve watched enough YouTube videos to be able to spot fakes. Mine are definitely 1st gen. This is how you can tell:If the picture on the back of the box includes the charger, it is 1st gen. The 2nd gen AirPod box doesn’t feature a picture of the charging cable on the back; all you’d see are the AirPods in their case. The 2nd gen case also has a tiny little dot on the front, a light that turns on when the case is charging wirelessly. The 1st gen case does not have that feature, so, of course, there’s no light on the front.But seriously, that’s the only feature you’re missing out on, other than maybe some better sound quality that you won’t really miss unless you’ve used 2nd gens before. Again, these are really great."
16,"October 6, 2020",5.0,Good sound quality and long battery life,"  The sound quality is very good, and I am also very satisfied with the battery life of the product so far. I wanted to order it for a long time but didn’t want to spend so much money on it, but at the end I didn’t regret buying it, I am extremely happy with my purchase"
17,"October 6, 2020",5.0,Love them!,  my daughter loves her new airpods.  hands free calling and the call quality is very good.
18,"October 6, 2020",2.0,Didn't Last,"  I'm not sure why, but my son's AirPods within 6 months lost their battery life and one of the sides stopped working.  Wish I could return them for a different pair."
19,"October 6, 2020",5.0,Do it for the meme,  Can't hear broke now
20,"October 6, 2020",5.0,Worth the price,"  work great and are really comfortable to my ears. Aesthetically, they look great to me."
21,"October 6, 2020",1.0,Airpods wont connect together after 6 months,  These sounded and worked great for about 6 months. Now they both wont connect at the same time. I’ve done all the troubleshooting to restart the AirPods and nothing will get them to work at the same time. Bummer.
22,"October 6, 2020",5.0,Be careful don’t loose them,  Love them
23,"October 6, 2020",5.0,Airpods,  My son loves his airpods.
24,"October 6, 2020",5.0,10/10 Recommend,  I absolutely love my AirPods.
25,"October 6, 2020",1.0,Disappointed,  Only one earphone works
26,"October 6, 2020",5.0,Awesome product,  Excellent quality. Very pleased.
27,"October 5, 2020",5.0,Love it,  Love it
28,"October 5, 2020",5.0,They are awesome; also everyone including thier grandmother has a pair,  See headline lol
29,"October 5, 2020",1.0,mistaken,  I did not realize that this product was made by Apple. Very disappointed. Would not purchase again.
30,"October 5, 2020",5.0,Love them,"  I really enjoy these. I was so worried about them falling out my ear but they actually don’t, I love that when I take them out of my ear the music stops. These are just the most convenient earbuds ever."
31,"October 5, 2020",5.0,"Quality sound, low quality noise cancellation.",  Sound quality is on point. These are not great at noise canceling. The extended battery life is very helpful.
32,"October 5, 2020",5.0,Long lasting battery life,  Sound quality is great. I love using these when I facetime because I can hear the other person so much better. Also the battery life is much better than I expected.
33,"October 5, 2020",4.0,Amazing product,"  Amazing product, the sound quality is very good. I had airpods before but they were around 2-3 years old and the battery died very very fast! bought these and the battery has been doing good so far. Also the volume is very loud!"
34,"October 5, 2020",5.0,Legitimate. Does everything it's supposed to.,  They're genuine apple airpods (Go on Apple.com / Serial Number Check) to verify they're legitimate when you get them.Sidenote: The Case Lid is the one that's supposed to match the Serial number on the box. Each apple airpod has a differing serial number on the pod itself.Arrived within one day brand spankin' new. Highly recommend. It feels great to cut the cord and be truly wireless especially when paired with an apple watch!
35,"October 5, 2020",5.0,very fast shipping!,  great product!
36,"October 5, 2020",1.0,Garbage,  These are terrible. Overpriced for nothing. Regularly have problems with it. Had them replaced several times. Then apple refuses to fix them. Just want you to buy their more expensive higher product.
37,"October 5, 2020",5.0,Great,  Great
38,"October 5, 2020",4.0,Good quality,"  Great sound quality, easy to connect Bluetooth. Just wish it had a longer battery life."
39,"October 5, 2020",5.0,Buenos deseos,  Me agrado
40,"October 5, 2020",5.0,My favorite,"  I love the air pods. They’re so much better than any other earbuds I’ve tried to date. They are loud, noise cancellation is perfect and other people hear me clearly when speaking on calls. Absolutely love them."
41,"October 5, 2020",5.0,Their Apple they better work,"  There are several AirPods on the market and I have tried a couple .. I have had zero success.  Be cause I have had zero success, I made the investment into Apples AirPods ..  do they have exceptional sound for music .. sort of but they work and that’s what I need."
42,"October 5, 2020",5.0,Good,  Great price
43,"October 5, 2020",1.0,Stopped working after 2 weeks,  They were great at first but now they aren’t working. I’ve had them for only two weeks and they won’t reconnect to my phone. We even tried connecting them to my husbands phone but it only makes a static noise in the headphones. Super unfortunate that I wasted my money
44,"October 5, 2020",5.0,Excellent,  Very easy connecting to different devices.  Sound quality is great.  Worth the price.
45,"October 5, 2020",3.0,Sounds great when they’re working.,"  They sound good, when both AirPods work! Put them in, the left one doesn’t work - I unpair them from my phone and reset them and they’re fine until I use them again and the right one doesn’t work. Then I go through the process again. I bought them in August of this year. Very disappointed."
46,"October 5, 2020",5.0,Great and are a genuine apple product,"  I loved it, easy to set up and use, highly recommend!"
47,"October 5, 2020",5.0,Full marks,  Full marks
48,"October 5, 2020",5.0,Would recommend,  I was very hesitant to purchase these due to price. I ended up caving. I’ve owned them for several months and I am so glad I finally bought them. The battery lasts a very long time. Sound quality is great. I love them.
49,"October 5, 2020",5.0,Great Product,"  This was a must have product for my teenager, but we loved getting these for such a great deal!  Great product with great sound quality!"
50,"October 5, 2020",1.0,DON'T waste your $ on Apple,"  Item is 3 months old.  Both will not play simultaneously.  I am tech savvy, went through all the trouble shooting instructions.  Wasted my time calling Apple.  Unbelievable that they will not replace item without your credit card on hold for the returned defective item.  My other son bought Jaybird's - not one issue!!!"
51,"October 5, 2020",5.0,"Gnarly sound, love the pause feature!","  I’m pretty in love wit these pups! I have a few pair of beats, and my husband ordered these for me because he bought himself something without letting me know. I told him I’d probably return them. I decided to keep them because they have killer sound, and I feel super high speed walking around with air pods. I really love how you take one out, and it pauses whatever you’re doing. I’m a huge podcast listener, it’s nice to automatically have it paused so I’m not missing out on true crime goodness! AirPods are kind of a game changer!"
52,"October 5, 2020",5.0,Love it,  Authentic & just as described
53,"October 5, 2020",5.0,Love them <3,  i bought 2 pair and love them soo much 1 one was a gift and the  other was for me
54,"October 4, 2020",5.0,convenient & great quality,  these work so great & its so much better than wired headphones. i seriously love these. theyre vey convenient & discreet. the sound quality is amazing. the charging case holds a charge for so long & i can go days without having to charge it. airpods die within a few hours but all you have to do is pop them back in the case for a little & youre good to go. its very much worth the price. ditch your wired headphones asap
55,"October 4, 2020",5.0,great buy,  great investment! love my airpods! 10/10
56,"October 4, 2020",5.0,Sound quality.,  Stays charged really well and connects easily.
57,"October 4, 2020",5.0,Amazing battery life and sound quality!!!,  They’re great! I honestly use them all the time and yet they seem to never run out of battery. The sound quality is amazing and I love how fast they connect after you put them in your ears.
58,"October 4, 2020",5.0,Good,  Overall good
59,"October 4, 2020",5.0,"Easy to wear, great sound for the wearer, no sound for those close by.","  I love these air pods!  I use them mainly to listen to books at night when I go to bed.  My husband is happy I no longer have the light on for an hour or so.  He can’t hear anything from the air pods as I use them, the light is out, he’s a happy guy!"
60,"October 4, 2020",1.0,Garbage don’t buy from here,  Stopped charging after a few uses.
61,"October 4, 2020",5.0,Good. Would recommend,  Literally just apple airpods. Good sound quality and pairs nicely. Had them for over 6 months now and still in great shape both visually and sound quality wise
62,"October 4, 2020",5.0,Best Purchase,  Best purchase! Great for an active life style I’d you don’t want annoying cords! Delivery was super nice too they made sure I got them at the door so no one would steal them and there was a warning on the box to make sure it wasn’t in any extreme temperature.
63,"October 4, 2020",5.0,love,"  i love these AirPods. I didnt see the point in dropping money to buy the new gen airpods, so i just got these. they're great!"
64,"October 4, 2020",1.0,Unhappy customer,"  I bought the AirPods on Aug 12. I do not use them often, I purchased them for my second job. I clean an office once a week. One of of them have already quit working!! It hasn't even been 2 months and have used them a handful of times! I should get better life out of them 😡"
65,"October 4, 2020",4.0,Clear,"  This product is very easy to use, the sound is clear, it is worth having."
66,"October 4, 2020",5.0,Great for video calls,"  Great for music and video calls, but battery dies after all day calls."
67,"October 4, 2020",4.0,Great,  They cut in and out after a months of usage.
68,"October 4, 2020",5.0,Bueno,  Llegaron bien
69,"October 4, 2020",4.0,Great,  They are great. I have a hard time with controls on the earbuds themselves. They dont seem as responsive.
70,"October 3, 2020",5.0,Never die on me.,"  Regular apple airpods, just as you’d expect. They sound perfect after a few months of use so far"
71,"October 3, 2020",5.0,Game-changer,"  I didn’t know what I was missing!  I walk a couple of miles each morning and had been using corded earbuds, which I all too often would accidentally catch my hand on, or not have enough length to carry my phone in a pocket.  These eliminated those issues.  I am also working remotely and have several ZOOM meetings a week.  I have started using the Air Pods for those as well.  They’re great for working in the yard without having to keep phone in hand or pocket.  Sound is very good.  Charge time is as advertised and recharge time is quick."
72,"October 3, 2020",5.0,Great!,  Couldn’t have asked for better ❤️
73,"October 3, 2020",5.0,Authentic Apple,"  We considered buying a knockoff brand, but we ended up going with the real deal and so glad we did. You cannot go wrong with Apple. Great products, always! This is definitely an authentic product."
74,"October 3, 2020",5.0,Overall,  They work how they supposed to work!
75,"October 3, 2020",4.0,WORKS GREAT,  MUSIC & PHONE CALLS WATCHING VIDEO’S
76,"October 3, 2020",5.0,Value for your money,  Am in love
77,"October 3, 2020",3.0,A little noise,"  The sound quality is average, there are a little bit noise, ears will hurt after wear a long time"
78,"October 3, 2020",5.0,Excellent Sound Quality,  I spend a lot of time on the phone for work - and I like how I can walk away from my phone but continue in my conversation.  It's SO helpful for multi-tasking.  I do wish the battery life lasted longer though.
79,"October 3, 2020",5.0,Overall good product and delivery process along with the early delivery!,  I give this product two thumbs up 👍.the overall delivery was amazing and in such a timely manner. My package was definitely early which is awesome ! I’m passing the word. Keep up the good work .
80,"October 3, 2020",5.0,Good Quality,  I love my Airpods! The sound quality and noise cancellation are great and the battery lasts a long time. I can go a pretty long time without having to charge them.
81,"October 3, 2020",5.0,Better than I would have ever expected!!!,"  I really can’t say enough good things about these AirPods. I have purchased the “knock off” brands that look similar and have had multiple problems with them. I was a little hesitant in spending the extra cash... compared to the $30 “knock offs”.  But after opening the box the AirPods, they immediately were recognized by mu iPhone. The sound quality was probably the best I have ever experienced with earbuds. I think they are better than a pair of Bose that I used to use... These are the real deal.. The size of the case is smaller and feels very well constructed. Like I said... I am completely satisfied and would recommend.. do not waste your time on the “knock off” brands... Go for the AirPods!!!ThanksJay"
82,"October 3, 2020",1.0,Defective,  Defective never worked
83,"October 3, 2020",5.0,Love apple products,  Love the headset. I do not care for those that plug into my ear canal so these are so much better and comfortable to me. The sound it great.There is an occasional issue with the connection to my phone which means that I have to put them back in the case and take them back out to reset the connection and that seems to work very well.  I have even used them as the microphone to record video.  I love the set an use them so much I have to remember to charge them when not in use.  I believe it takes at least 3 - 5 hours on a call or listening to music or podcasts.Great product and I truly hope Apple does not stop making them incase I do need to replace them at some time.  I do not like the newer version as I said before.  I really do not like any headsets that plug into my ear canal.Great product and Highly recommended.
84,"October 3, 2020",3.0,If you suffer from migraines don’t get them,"  The sound quality is great. They charge extremely fast and the battery life is pretty good. However, they give me intense migraines."
85,"October 3, 2020",5.0,Work Great!,  Fast deliveryBought them for our Grandson he uses them all the time.
86,"October 3, 2020",5.0,Great sound quality,"  Bought these for my daughter and she loves them, great noise canceling sound"
87,"October 3, 2020",5.0,Review,"  I love my AirPods! I use them everyday, all day. The battery life is very good and it charges fairly quickly. The sound quality is fantastic! I have recommended two people  to these and they love theirs as well."
88,"October 2, 2020",5.0,Nice,"  Even when the Pro coming out, I still like this one better. Everything is perfect, the price is great. Only the shipment running late, that is the only thing I can complete about it."
89,"October 2, 2020",5.0,Producto original y sellado,"  Bien empaquetado, sellado y original. Buena calidad de audio y duración de batería"
90,"October 2, 2020",5.0,Muy prácticos y originales,"  La mejor inversión, Útil para ejercitarse sin incomodarse por los molestos cables, Vino en su caja original, perfectamente sellado."
91,"October 2, 2020",5.0,Muy buenos,"  No son fake, son orijinales, no se porque la jente comenta que son de mala calidad, me encantan😁😆🤩"
92,"October 2, 2020",4.0,good product but for me very uncomfortable,  good product but for me very uncomfortable
93,"October 2, 2020",5.0,Great value,  Great product good value
94,"October 2, 2020",5.0,no wires,  this is a quality product and a satisfyingly quality package. The buds fit fine and the case is simply magnificently wellwell designed and manufactured.  Don't stand over a storm drain and adjust the pods.
95,"October 2, 2020",5.0,Awsome,  Nothing
96,"October 2, 2020",5.0,Definitely worth every penny and then some,  I love my AirPods. I thought about getting the AirPods Pro but I didn’t wanna spend that much more just to have the noise canceling feature. Now I will probably upgrade in a year or two now that they’ve even improved the AirPods Pro even more.Coming from somebody who has an iPad and iPhone and an iMac at home having the AirPods and the ability to Switch between them so effortlessly without having to unpair and repair is so nice.I’ve had a number of Bluetooth headsets over the years from Plantronics to generic to a number of other different companies I don’t even know if I could remember every different manufacture that I’ve had. I always hated that they were bulky they never fit in my ear just right. I just never felt like they were great and it was always complicated they seem to fuss to pair up and especially if they ever unpaired then it was starting all over again. I love that the minute that I got my AirPods I flipped open the case and right away my iPhone registers that they are there and with the top of a Button on my phone and the top of the button on the AirPods in a couple of seconds I am paired up.I also have a very nice charger that I bought right here on Amazon for about $25 and it will charge my Apple Pencil my AirPods my Apple Watch and my iPhone all at the same time which is amazing and so nice that I can just click my AirPods case on there and they charge up in a very short time.First off I’m not a sound engineer or an audio file so I can’t say that they have the absolute best sound quality and I’m sure that they don’t I can’t imagine that if you went out and got some of the beads or some other type of wireless headset that fits over your entire ear with a bigger driver in it that of course it’s going to have better sound quality.But I love that they are tiny small and easy to just throw in the case. The battery life is great if my case is fully charged with the AirPods in and charged I can go to complete times to almost dead with both AirPods being used. If I only use one way talking on the phone I can go even more so in between case charging times is sometimes over a week which is absolutely amazing. The talk time on them is very long as well. I’ve never sat down and figured up exactly whether I get the exact time that Apple says.I love that the minute that I put them in my ear I get a nice little tone to let me know that they’ve connected if I’m listening to music and I take them out it automatically pauses. I love that it will even pause my music if I get an iMessage and it will read my message it will tell me who it’s from if they’re in my contact list if not it will read me the phone number and then read me the message and then asked me if I would like to respond all without touching my phone.I love Apple products even if they are a little more expensive in some areas but I love that for instance with the AirPods home they tie Effortlessly Into my phone my Mac and my iPad.I absolutely hate when I am talking on the phone for more than a couple of minutes to have to hold the phone. Also I run a business and so I have to multitask sometimes someone calls and I need to be able to pick up a remote to navigate to something to check I may need to grab the computer etc. and having the ability to have both hands free to do something like that while still talking and not worrying about the AirPods falling out of my ear is worth more than the money that I paid for them by far and then all the other features that come with it are great.So in the end I think that they are amazing and I’ve had it again a number of different Bluetooth headsets and they never fit right they fall out of my ear or the ones that took over my ears are always so uncomfortable after a short period of time that I never ended up using them I always ended up using my wired earbuds that come with my iPhone.
97,"October 2, 2020",5.0,Great Product,"  They're great, worth every penny.  My only regret is that I didn't purchase them sooner.  What are you waiting for, buy them!"
98,"October 2, 2020",4.0,base model Apple Airpods,  Seem to be working fine.. battery life is OK.. don't expect to wear them all day without having to charge them again in the case. They fit my ears just fine buy my husband can't use them because they fall out of his all the time.
99,"October 2, 2020",4.0,Decent,"  These are pretty good, but sometimes they randomly disconnect from Bluetooth, turn off, or just stop playing music while being connected to Bluetooth. Battery and everything was perfect."
100,"October 2, 2020",5.0,Great airpods,  Perfect sound without the extra noise. Great battery life.
101,"October 2, 2020",5.0,I am very fond of,  I am very fond of
102,"October 2, 2020",1.0,Defective,  Right AirPod didn’t work. Complete waste of a purchase and terrible returning issues. Just get them from the Apple store
103,"October 2, 2020",5.0,Real airpods,  Was worried because I heard of people getting fake or used AirPods off Amazon but these were legit and awesome. Bought them for my husband and he uses them everyday. Also worth noting they have survived 2 trips in the washing machine and dryer and still work great lol
104,"October 2, 2020",5.0,Excellent,  Love the sound quality
105,"October 2, 2020",5.0,what I really use them for or wanted them for,  they work very well.  Except for being able to use them on older ipod and phone.  I have audio books on ipod and phone and they dont work on older products.
106,"October 2, 2020",5.0,Headphone.,"  These headphones are the best, If for some reason they brake or I loss them, I will be buying them again."
